{
 "format": "false_friends",
 "video_id": null,
 "series_id": null,
 "episode_no": 7,
 "canvas": {
  "w": 1080,
  "h": 1920,
  "fps": 30
 },
 "theme": {
  "palette": {
   "name": "limone",
   "bg": "#FAF08C",
   "bg2": null,
   "title_bg": "#FF7A1A",
   "title_text": "#FFFFFF",
   "left_bg": "#141414",
   "left_text": "#FFFFFF",
   "right_bg": "#FFFFFF",
   "right_text": "#141414",
   "highlight_bg": "#2DE53A",
   "highlight_text": "#0B2E0F",
   "highlight_left_text": "#FFE600",
   "accent": "#D7263D"
  },
  "font": "Montserrat",
  "badge_shape": "square",
  "layout": "center",
  "stickers": [
   {
    "name": "star",
    "x": 860.0,
    "y": 1600.0,
    "size": 124.0,
    "rotate": 12.0
   },
   {
    "name": "italy",
    "x": 950.0,
    "y": 600.0,
    "size": 96.0,
    "rotate": -12.0
   }
  ],
  "bookmark": {
   "enabled": false,
   "position": "top_right"
  },
  "watermark": "@ItalianoPerTe",
  "show_progress_bar": true,
  "second_lang": null
 },
 "hook_text": "Non è quello che pensi!",
 "title": "Falsi amici",
 "cta_text": "Scrivi nei commenti 👇",
 "body": {
  "lang": "en",
  "items": [
   {
    "it": "camera",
    "looks_like": "camera",
    "it_means": "room",
    "say_instead": "macchina fotografica"
   },
   {
    "it": "parenti",
    "looks_like": "parents",
    "it_means": "relatives",
    "say_instead": "genitori"
   },
   {
    "it": "morbido",
    "looks_like": "morbid",
    "it_means": "soft",
    "say_instead": "morboso"
   },
   {
    "it": "libreria",
    "looks_like": "library",
    "it_means": "bookshop",
    "say_instead": "biblioteca"
   },
   {
    "it": "fattoria",
    "looks_like": "factory",
    "it_means": "farm",
    "say_instead": "fabbrica"
   }
  ]
 },
 "timeline": [
  {
   "t_start": 0.0,
   "t_end": 1.935,
   "action": "hook",
   "target": null
  },
  {
   "t_start": 8.585,
   "t_end": 10.945,
   "action": "cta",
   "target": null
  },
  {
   "t_start": 1.935,
   "t_end": 3.265,
   "action": "highlight",
   "target": "row:0"
  },
  {
   "t_start": 3.265,
   "t_end": 4.595,
   "action": "highlight",
   "target": "row:1"
  },
  {
   "t_start": 4.595,
   "t_end": 5.925,
   "action": "highlight",
   "target": "row:2"
  },
  {
   "t_start": 5.925,
   "t_end": 7.255,
   "action": "highlight",
   "target": "row:3"
  },
  {
   "t_start": 7.255,
   "t_end": 10.945,
   "action": "highlight",
   "target": "row:4"
  }
 ],
 "audio": {
  "voice_url": null,
  "music_url": null,
  "music_volume": 0.08,
  "sfx": [
   {
    "t": 8.585,
    "name": "whoosh",
    "volume": 0.25
   },
   {
    "t": 1.935,
    "name": "pop",
    "volume": 0.3
   },
   {
    "t": 3.265,
    "name": "pop",
    "volume": 0.3
   },
   {
    "t": 4.595,
    "name": "pop",
    "volume": 0.3
   },
   {
    "t": 5.925,
    "name": "pop",
    "volume": 0.3
   },
   {
    "t": 7.255,
    "name": "pop",
    "volume": 0.3
   }
  ],
  "envelope": [
   0.0,
   0.0,
   0.0,
   0.632,
   1.0,
   1.0,
   1.0,
   1.0,
   1.0,
   1.0,
   1.0,
   1.0,
   1.0,
   1.0,
   1.0,
   1.0,
   1.0,
   1.0,
   1.0,
   1.0,
   1.0,
   1.0,
   1.0,
   1.0,
   1.0,
   1.0,
   1.0,
   1.0,
   1.0,
   1.0,
   1.0,
   1.0,
   1.0,
   1.0,
   1.0,
   1.0,
   1.0,
   1.0,
   1.0,
   1.0,
   1.0,
   1.0,
   1.0,
   1.0,
   1.0,
   1.0,
   1.0,
   1.0,
   1.0,
   0.223,
   0.0,
   0.0,
   0.0,
   0.0,
   0.0,
   0.0,
   0.0,
   0.0,
   0.975,
   1.0,
   1.0,
   1.0,
   1.0,
   1.0,
   1.0,
   1.0,
   1.0,
   1.0,
   1.0,
   1.0,
   1.0,
   1.0,
   1.0,
   1.0,
   1.0,
   0.671,
   0.0,
   0.0,
   0.0,
   0.0,
   0.0,
   0.0,
   0.0,
   0.0,
   0.0,
   0.0,
   0.0,
   0.0,
   0.0,
   0.0,
   0.0,
   0.0,
   0.0,
   0.0,
   0.0,
   0.0,
   0.0,
   0.224,
   1.0,
   1.0,
   1.0,
   1.0,
   1.0,
   1.0,
   1.0,
   1.0,
   1.0,
   1.0,
   1.0,
   1.0,
   1.0,
   1.0,
   1.0,
   1.0,
   1.0,
   1.0,
   1.0,
   0.0,
   0.0,
   0.0,
   0.0,
   0.0,
   0.0,
   0.0,
   0.0,
   0.0,
   0.0,
   0.0,
   0.0,
   0.0,
   0.0,
   0.0,
   0.0,
   0.0,
   0.0,
   0.0,
   0.0,
   0.387,
   1.0,
   1.0,
   1.0,
   1.0,
   1.0,
   1.0,
   1.0,
   1.0,
   1.0,
   1.0,
   1.0,
   1.0,
   1.0,
   1.0,
   1.0,
   1.0,
   1.0,
   1.0,
   0.949,
   0.0,
   0.0,
   0.0,
   0.0,
   0.0,
   0.0,
   0.0,
   0.0,
   0.0,
   0.0,
   0.0,
   0.0,
   0.0,
   0.0,
   0.0,
   0.0,
   0.0,
   0.0,
   0.0,
   0.0,
   0.5,
   1.0,
   1.0,
   1.0,
   1.0,
   1.0,
   1.0,
   1.0,
   1.0,
   1.0,
   1.0,
   1.0,
   1.0,
   1.0,
   1.0,
   1.0,
   1.0,
   1.0,
   1.0,
   1.0,
   1.0,
   0.67,
   0.0,
   0.0,
   0.0,
   0.0,
   0.0,
   0.0,
   0.0,
   0.0,
   0.0,
   0.0,
   0.0,
   0.0,
   0.0,
   0.0,
   0.0,
   0.0,
   0.0,
   0.0,
   0.591,
   1.0,
   1.0,
   1.0,
   1.0,
   1.0,
   1.0,
   1.0,
   1.0,
   1.0,
   1.0,
   1.0,
   1.0,
   1.0,
   1.0,
   1.0,
   1.0,
   1.0,
   1.0,
   1.0,
   1.0,
   0.591,
   0.0,
   0.0,
   0.0,
   0.0,
   0.0,
   0.0,
   0.0,
   0.0,
   0.0,
   0.0,
   0.0,
   0.0,
   0.0,
   0.0,
   0.0,
   0.0,
   0.0,
   0.0,
   0.671,
   1.0,
   1.0,
   1.0,
   1.0,
   1.0,
   1.0,
   1.0,
   1.0,
   1.0,
   1.0,
   1.0,
   1.0,
   1.0,
   1.0,
   1.0,
   1.0,
   1.0,
   1.0,
   1.0,
   1.0,
   1.0,
   1.0,
   1.0,
   1.0,
   1.0,
   1.0,
   1.0,
   1.0,
   1.0,
   1.0,
   1.0,
   1.0,
   1.0,
   1.0,
   1.0,
   1.0,
   1.0,
   1.0,
   1.0,
   1.0,
   1.0,
   1.0,
   1.0,
   0.592,
   0.0,
   0.0,
   0.0,
   0.0,
   0.0,
   0.0,
   0.0,
   0.0,
   0.0,
   0.0,
   0.0,
   0.0,
   0.0,
   0.0,
   0.0,
   0.0,
   0.0,
   0.0,
   0.0,
   0.0,
   0.0,
   0.0,
   0.0,
   0.0,
   0.0,
   0.0,
   0.0
  ]
 },
 "avatar": {
  "mode": "none",
  "src": null,
  "position": "bottom_right",
  "height": 620
 },
 "loop_seamless": true,
 "duration_s": 10.945,
 "asset_base": "",
 "seed": 11,
 "show_yt_overlay": false
}