{
 "format": "fill_blank",
 "video_id": null,
 "series_id": null,
 "episode_no": 7,
 "canvas": {
  "w": 1080,
  "h": 1920,
  "fps": 30
 },
 "theme": {
  "palette": {
   "name": "pesca",
   "bg": "#FFD7A8",
   "bg2": "#FFB4A2",
   "title_bg": "#FFE135",
   "title_text": "#1B1B1B",
   "left_bg": "#141414",
   "left_text": "#FFFFFF",
   "right_bg": "#FFFFFF",
   "right_text": "#141414",
   "highlight_bg": "#2DE53A",
   "highlight_text": "#0B2E0F",
   "highlight_left_text": "#FFE600",
   "accent": "#E3262E"
  },
  "font": "Montserrat",
  "badge_shape": "square",
  "layout": "center",
  "stickers": [
   {
    "name": "star",
    "x": 860.0,
    "y": 1600.0,
    "size": 124.0,
    "rotate": 12.0
   },
   {
    "name": "italy",
    "x": 950.0,
    "y": 600.0,
    "size": 96.0,
    "rotate": -12.0
   }
  ],
  "bookmark": {
   "enabled": false,
   "position": "top_right"
  },
  "watermark": "@ItalianoPerTe",
  "show_progress_bar": true,
  "second_lang": "ru"
 },
 "hook_text": "Di, a o da?",
 "title": "Completa la frase",
 "cta_text": "Scrivi nei commenti 👇",
 "body": {
  "sentence": "Vado ___ ristorante.",
  "options": [
   "a",
   "al",
   "in"
  ],
  "correct": 1,
  "translation": "Я иду в ресторан.",
  "timer_s": 3,
  "reveal": true
 },
 "timeline": [
  {
   "t_start": 0.0,
   "t_end": 1.275,
   "action": "hook",
   "target": null
  },
  {
   "t_start": 11.325,
   "t_end": 13.685,
   "action": "cta",
   "target": null
  },
  {
   "t_start": 1.275,
   "t_end": 3.425,
   "action": "highlight",
   "target": "q"
  },
  {
   "t_start": 3.425,
   "t_end": 4.425,
   "action": "highlight",
   "target": "opt:0"
  },
  {
   "t_start": 4.425,
   "t_end": 5.425,
   "action": "highlight",
   "target": "opt:1"
  },
  {
   "t_start": 5.425,
   "t_end": 6.425,
   "action": "highlight",
   "target": "opt:2"
  },
  {
   "t_start": 6.425,
   "t_end": 9.425,
   "action": "countdown",
   "target": 3
  },
  {
   "t_start": 9.425,
   "t_end": 13.685,
   "action": "reveal",
   "target": "opt:1"
  }
 ],
 "audio": {
  "voice_url": null,
  "music_url": null,
  "music_volume": 0.08,
  "sfx": [
   {
    "t": 11.325,
    "name": "whoosh",
    "volume": 0.25
   },
   {
    "t": 1.275,
    "name": "pop",
    "volume": 0.3
   },
   {
    "t": 3.425,
    "name": "pop",
    "volume": 0.3
   },
   {
    "t": 4.425,
    "name": "pop",
    "volume": 0.3
   },
   {
    "t": 5.425,
    "name": "pop",
    "volume": 0.3
   },
   {
    "t": 9.425,
    "name": "ding",
    "volume": 0.45
   },
   {
    "t": 9.425,
    "name": "confetti",
    "volume": 0.35
   },
   {
    "t": 6.425,
    "name": "tick",
    "volume": 0.5
   },
   {
    "t": 7.425,
    "name": "tick",
    "volume": 0.5
   },
   {
    "t": 8.425,
    "name": "tick",
    "volume": 0.5
   }
  ],
  "envelope": [
   0.0,
   0.0,
   0.0,
   0.632,
   1.0,
   1.0,
   1.0,
   1.0,
   1.0,
   1.0,
   1.0,
   1.0,
   1.0,
   1.0,
   1.0,
   1.0,
   1.0,
   1.0,
   1.0,
   1.0,
   1.0,
   1.0,
   1.0,
   1.0,
   1.0,
   1.0,
   1.0,
   1.0,
   1.0,
   0.5,
   0.0,
   0.0,
   0.0,
   0.0,
   0.0,
   0.0,
   0.0,
   0.0,
   0.866,
   1.0,
   1.0,
   1.0,
   1.0,
   1.0,
   1.0,
   1.0,
   1.0,
   1.0,
   1.0,
   1.0,
   1.0,
   1.0,
   1.0,
   1.0,
   1.0,
   1.0,
   1.0,
   1.0,
   1.0,
   1.0,
   1.0,
   1.0,
   1.0,
   1.0,
   1.0,
   1.0,
   1.0,
   1.0,
   1.0,
   1.0,
   1.0,
   1.0,
   1.0,
   1.0,
   1.0,
   0.671,
   0.0,
   0.0,
   0.0,
   0.0,
   0.0,
   0.0,
   0.0,
   0.0,
   0.0,
   0.0,
   0.0,
   0.0,
   0.0,
   0.0,
   0.0,
   0.0,
   0.0,
   0.0,
   0.0,
   0.0,
   0.0,
   0.0,
   0.0,
   0.0,
   0.0,
   0.0,
   0.5,
   1.0,
   1.0,
   1.0,
   1.0,
   1.0,
   1.0,
   1.0,
   1.0,
   0.948,
   0.0,
   0.0,
   0.0,
   0.0,
   0.0,
   0.0,
   0.0,
   0.0,
   0.0,
   0.0,
   0.0,
   0.0,
   0.0,
   0.0,
   0.0,
   0.0,
   0.0,
   0.0,
   0.0,
   0.0,
   0.5,
   1.0,
   1.0,
   1.0,
   1.0,
   1.0,
   1.0,
   1.0,
   1.0,
   1.0,
   1.0,
   0.741,
   0.0,
   0.0,
   0.0,
   0.0,
   0.0,
   0.0,
   0.0,
   0.0,
   0.0,
   0.0,
   0.0,
   0.0,
   0.0,
   0.0,
   0.0,
   0.0,
   0.0,
   0.0,
   0.5,
   1.0,
   1.0,
   1.0,
   1.0,
   1.0,
   1.0,
   1.0,
   1.0,
   1.0,
   1.0,
   0.741,
   0.0,
   0.0,
   0.0,
   0.0,
   0.0,
   0.0,
   0.0,
   0.0,
   0.0,
   0.0,
   0.0,
   0.0,
   0.0,
   0.0,
   0.0,
   0.0,
   0.0,
   0.0,
   0.0,
   0.0,
   0.0,
   0.0,
   0.0,
   0.0,
   0.0,
   0.0,
   0.0,
   0.0,
   0.0,
   0.0,
   0.0,
   0.0,
   0.0,
   0.0,
   0.0,
   0.0,
   0.0,
   0.0,
   0.0,
   0.0,
   0.0,
   0.0,
   0.0,
   0.0,
   0.0,
   0.0,
   0.0,
   0.0,
   0.0,
   0.0,
   0.0,
   0.0,
   0.0,
   0.0,
   0.0,
   0.0,
   0.0,
   0.0,
   0.0,
   0.0,
   0.0,
   0.0,
   0.0,
   0.0,
   0.0,
   0.0,
   0.0,
   0.0,
   0.0,
   0.0,
   0.0,
   0.0,
   0.0,
   0.0,
   0.0,
   0.0,
   0.0,
   0.0,
   0.0,
   0.0,
   0.0,
   0.0,
   0.0,
   0.0,
   0.0,
   0.0,
   0.0,
   0.0,
   0.0,
   0.0,
   0.0,
   0.0,
   0.0,
   0.0,
   0.0,
   0.0,
   0.0,
   0.0,
   0.0,
   0.0,
   0.0,
   0.0,
   0.0,
   0.0,
   0.0,
   0.0,
   0.0,
   0.0,
   0.5,
   1.0,
   1.0,
   1.0,
   1.0,
   1.0,
   1.0,
   1.0,
   1.0,
   1.0,
   1.0,
   1.0,
   1.0,
   1.0,
   1.0,
   1.0,
   1.0,
   1.0,
   1.0,
   1.0,
   1.0,
   1.0,
   1.0,
   1.0,
   1.0,
   1.0,
   1.0,
   1.0,
   1.0,
   1.0,
   1.0,
   1.0,
   1.0,
   1.0,
   1.0,
   1.0,
   1.0,
   1.0,
   1.0,
   0.775,
   0.0,
   0.0,
   0.0,
   0.0,
   0.0,
   0.0,
   0.0,
   0.0,
   0.0,
   0.0,
   0.0,
   0.0,
   0.0,
   0.0,
   0.0,
   0.0,
   0.0,
   0.5,
   1.0,
   1.0,
   1.0,
   1.0,
   1.0,
   1.0,
   1.0,
   1.0,
   1.0,
   1.0,
   1.0,
   1.0,
   1.0,
   1.0,
   1.0,
   1.0,
   1.0,
   1.0,
   1.0,
   1.0,
   1.0,
   1.0,
   1.0,
   1.0,
   1.0,
   1.0,
   1.0,
   1.0,
   1.0,
   1.0,
   1.0,
   1.0,
   1.0,
   1.0,
   1.0,
   1.0,
   1.0,
   1.0,
   1.0,
   1.0,
   1.0,
   1.0,
   1.0,
   0.741,
   0.0,
   0.0,
   0.0,
   0.0,
   0.0,
   0.0,
   0.0,
   0.0,
   0.0,
   0.0,
   0.0,
   0.0,
   0.0,
   0.0,
   0.0,
   0.0,
   0.0,
   0.0,
   0.0,
   0.0,
   0.0,
   0.0,
   0.0,
   0.0,
   0.0,
   0.0,
   0.0
  ]
 },
 "avatar": {
  "mode": "none",
  "src": null,
  "position": "bottom_right",
  "height": 620
 },
 "loop_seamless": true,
 "duration_s": 13.685,
 "asset_base": "",
 "seed": 11,
 "show_yt_overlay": false
}