{
 "format": "daily_word",
 "video_id": null,
 "series_id": null,
 "episode_no": 7,
 "canvas": {
  "w": 1080,
  "h": 1920,
  "fps": 30
 },
 "theme": {
  "palette": {
   "name": "basilico",
   "bg": "#A5D86E",
   "bg2": null,
   "title_bg": "#FFE135",
   "title_text": "#1B1B1B",
   "left_bg": "#1E3A0F",
   "left_text": "#FFFFFF",
   "right_bg": "#FFFFFF",
   "right_text": "#1E3A0F",
   "highlight_bg": "#FFE135",
   "highlight_text": "#1B1B1B",
   "highlight_left_text": "#FFE600",
   "accent": "#C2185B"
  },
  "font": "Montserrat",
  "badge_shape": "square",
  "layout": "center",
  "stickers": [
   {
    "name": "star",
    "x": 860.0,
    "y": 1600.0,
    "size": 124.0,
    "rotate": 12.0
   },
   {
    "name": "italy",
    "x": 950.0,
    "y": 600.0,
    "size": 96.0,
    "rotate": -12.0
   }
  ],
  "bookmark": {
   "enabled": false,
   "position": "top_right"
  },
  "watermark": "@ItalianoPerTe",
  "show_progress_bar": true,
  "second_lang": "ru"
 },
 "hook_text": "Parola del giorno!",
 "title": "Parola del giorno",
 "cta_text": "Scrivi nei commenti 👇",
 "body": {
  "word": "magari",
  "article": null,
  "syllables": "ma-GA-ri",
  "part_of_speech": "avverbio",
  "translation": "может быть; хотелось бы!",
  "example": "Vieni stasera? Magari!",
  "example_translation": "Придёшь вечером? Хотелось бы!"
 },
 "timeline": [
  {
   "t_start": 0.0,
   "t_end": 1.66,
   "action": "hook",
   "target": null
  },
  {
   "t_start": 7.76,
   "t_end": 10.12,
   "action": "cta",
   "target": null
  },
  {
   "t_start": 1.66,
   "t_end": 3.56,
   "action": "highlight",
   "target": "card"
  },
  {
   "t_start": 3.56,
   "t_end": 5.26,
   "action": "speak_slow",
   "target": "card"
  },
  {
   "t_start": 5.26,
   "t_end": 7.76,
   "action": "highlight",
   "target": "example"
  }
 ],
 "audio": {
  "voice_url": null,
  "music_url": null,
  "music_volume": 0.08,
  "sfx": [
   {
    "t": 7.76,
    "name": "whoosh",
    "volume": 0.25
   },
   {
    "t": 1.66,
    "name": "pop",
    "volume": 0.3
   },
   {
    "t": 5.26,
    "name": "pop",
    "volume": 0.3
   }
  ],
  "envelope": [
   0.0,
   0.0,
   0.0,
   0.632,
   1.0,
   1.0,
   1.0,
   1.0,
   1.0,
   1.0,
   1.0,
   1.0,
   1.0,
   1.0,
   1.0,
   1.0,
   1.0,
   1.0,
   1.0,
   1.0,
   1.0,
   1.0,
   1.0,
   1.0,
   1.0,
   1.0,
   1.0,
   1.0,
   1.0,
   1.0,
   1.0,
   1.0,
   1.0,
   1.0,
   1.0,
   1.0,
   1.0,
   1.0,
   1.0,
   1.0,
   0.894,
   0.0,
   0.0,
   0.0,
   0.0,
   0.0,
   0.0,
   0.0,
   0.0,
   0.447,
   1.0,
   1.0,
   1.0,
   1.0,
   1.0,
   1.0,
   1.0,
   1.0,
   1.0,
   1.0,
   1.0,
   1.0,
   1.0,
   1.0,
   1.0,
   1.0,
   1.0,
   0.447,
   0.0,
   0.0,
   0.0,
   0.0,
   0.0,
   0.0,
   0.0,
   0.0,
   0.0,
   0.0,
   0.0,
   0.0,
   0.0,
   0.0,
   0.0,
   0.0,
   0.0,
   0.0,
   0.0,
   0.0,
   0.0,
   0.0,
   0.0,
   0.0,
   0.0,
   0.0,
   0.0,
   0.0,
   0.0,
   0.0,
   0.0,
   0.0,
   0.0,
   0.0,
   0.0,
   0.0,
   0.0,
   0.0,
   0.447,
   1.0,
   1.0,
   1.0,
   1.0,
   1.0,
   1.0,
   1.0,
   1.0,
   1.0,
   1.0,
   1.0,
   1.0,
   1.0,
   1.0,
   1.0,
   1.0,
   1.0,
   0.447,
   0.0,
   0.0,
   0.0,
   0.0,
   0.0,
   0.0,
   0.0,
   0.0,
   0.0,
   0.0,
   0.0,
   0.0,
   0.0,
   0.0,
   0.0,
   0.0,
   0.0,
   0.0,
   0.0,
   0.0,
   0.0,
   0.0,
   0.0,
   0.0,
   0.0,
   0.0,
   0.0,
   0.0,
   0.0,
   0.0,
   0.0,
   0.0,
   0.447,
   1.0,
   1.0,
   1.0,
   1.0,
   1.0,
   1.0,
   1.0,
   1.0,
   1.0,
   1.0,
   1.0,
   1.0,
   1.0,
   1.0,
   1.0,
   1.0,
   1.0,
   1.0,
   1.0,
   1.0,
   1.0,
   1.0,
   1.0,
   1.0,
   1.0,
   1.0,
   1.0,
   1.0,
   1.0,
   1.0,
   1.0,
   1.0,
   1.0,
   1.0,
   1.0,
   1.0,
   1.0,
   1.0,
   1.0,
   1.0,
   1.0,
   1.0,
   1.0,
   0.775,
   0.0,
   0.0,
   0.0,
   0.0,
   0.0,
   0.0,
   0.0,
   0.0,
   0.0,
   0.0,
   0.0,
   0.0,
   0.0,
   0.0,
   0.0,
   0.0,
   0.0,
   0.0,
   0.0,
   0.0,
   0.0,
   0.0,
   0.0,
   0.0,
   0.0,
   0.0,
   0.0,
   0.0,
   0.0,
   0.0,
   0.447,
   1.0,
   1.0,
   1.0,
   1.0,
   1.0,
   1.0,
   1.0,
   1.0,
   1.0,
   1.0,
   1.0,
   1.0,
   1.0,
   1.0,
   1.0,
   1.0,
   1.0,
   1.0,
   1.0,
   1.0,
   1.0,
   1.0,
   1.0,
   1.0,
   1.0,
   1.0,
   1.0,
   1.0,
   1.0,
   1.0,
   1.0,
   1.0,
   1.0,
   1.0,
   1.0,
   1.0,
   1.0,
   1.0,
   1.0,
   1.0,
   1.0,
   1.0,
   1.0,
   0.775,
   0.0,
   0.0,
   0.0,
   0.0,
   0.0,
   0.0,
   0.0,
   0.0,
   0.0,
   0.0,
   0.0,
   0.0,
   0.0,
   0.0,
   0.0,
   0.0,
   0.0,
   0.0,
   0.0,
   0.0,
   0.0,
   0.0,
   0.0,
   0.0,
   0.0,
   0.0,
   0.0
  ]
 },
 "avatar": {
  "mode": "none",
  "src": null,
  "position": "bottom_right",
  "height": 620
 },
 "loop_seamless": true,
 "duration_s": 10.12,
 "asset_base": "",
 "seed": 11,
 "show_yt_overlay": false
}