{
 "format": "idiom",
 "video_id": null,
 "series_id": null,
 "episode_no": 7,
 "canvas": {
  "w": 1080,
  "h": 1920,
  "fps": 30
 },
 "theme": {
  "palette": {
   "name": "notte",
   "bg": "#1B1035",
   "bg2": "#3C1E6E",
   "title_bg": "#FFE135",
   "title_text": "#1B1B1B",
   "left_bg": "#000000",
   "left_text": "#FFFFFF",
   "right_bg": "#FFFFFF",
   "right_text": "#1B1035",
   "highlight_bg": "#2DE53A",
   "highlight_text": "#0B2E0F",
   "highlight_left_text": "#FFE600",
   "accent": "#FF4D6D"
  },
  "font": "Montserrat",
  "badge_shape": "square",
  "layout": "center",
  "stickers": [
   {
    "name": "star",
    "x": 860.0,
    "y": 1600.0,
    "size": 124.0,
    "rotate": 12.0
   },
   {
    "name": "italy",
    "x": 950.0,
    "y": 600.0,
    "size": 96.0,
    "rotate": -12.0
   }
  ],
  "bookmark": {
   "enabled": false,
   "position": "top_right"
  },
  "watermark": "@ItalianoPerTe",
  "show_progress_bar": true,
  "second_lang": "ru"
 },
 "hook_text": "Non tradurlo alla lettera!",
 "title": "Espressioni italiane",
 "cta_text": "Scrivi nei commenti 👇",
 "body": {
  "idiom": "In bocca al lupo!",
  "literal": "Во рту у волка!",
  "meaning": "Удачи!",
  "question": "E cosa si risponde?",
  "answer": "Crepi!",
  "example": null
 },
 "timeline": [
  {
   "t_start": 0.0,
   "t_end": 2.1,
   "action": "hook",
   "target": null
  },
  {
   "t_start": 10.1,
   "t_end": 12.46,
   "action": "cta",
   "target": null
  },
  {
   "t_start": 2.1,
   "t_end": 4.1,
   "action": "highlight",
   "target": "card"
  },
  {
   "t_start": 4.1,
   "t_end": 6.1,
   "action": "highlight",
   "target": "literal"
  },
  {
   "t_start": 6.1,
   "t_end": 8.4,
   "action": "highlight",
   "target": "meaning"
  },
  {
   "t_start": 8.4,
   "t_end": 12.46,
   "action": "highlight",
   "target": "question"
  }
 ],
 "audio": {
  "voice_url": null,
  "music_url": null,
  "music_volume": 0.08,
  "sfx": [
   {
    "t": 10.1,
    "name": "whoosh",
    "volume": 0.25
   },
   {
    "t": 2.1,
    "name": "pop",
    "volume": 0.3
   },
   {
    "t": 4.1,
    "name": "pop",
    "volume": 0.3
   },
   {
    "t": 6.1,
    "name": "pop",
    "volume": 0.3
   },
   {
    "t": 8.4,
    "name": "pop",
    "volume": 0.3
   }
  ],
  "envelope": [
   0.0,
   0.0,
   0.0,
   0.632,
   1.0,
   1.0,
   1.0,
   1.0,
   1.0,
   1.0,
   1.0,
   1.0,
   1.0,
   1.0,
   1.0,
   1.0,
   1.0,
   1.0,
   1.0,
   1.0,
   1.0,
   1.0,
   1.0,
   1.0,
   1.0,
   1.0,
   1.0,
   1.0,
   1.0,
   1.0,
   1.0,
   1.0,
   1.0,
   1.0,
   1.0,
   1.0,
   1.0,
   1.0,
   1.0,
   1.0,
   1.0,
   1.0,
   1.0,
   1.0,
   1.0,
   1.0,
   1.0,
   1.0,
   1.0,
   1.0,
   1.0,
   1.0,
   1.0,
   1.0,
   0.0,
   0.0,
   0.0,
   0.0,
   0.0,
   0.0,
   0.0,
   0.0,
   0.0,
   1.0,
   1.0,
   1.0,
   1.0,
   1.0,
   1.0,
   1.0,
   1.0,
   1.0,
   1.0,
   1.0,
   1.0,
   1.0,
   1.0,
   1.0,
   1.0,
   1.0,
   1.0,
   1.0,
   1.0,
   1.0,
   1.0,
   1.0,
   1.0,
   1.0,
   1.0,
   1.0,
   1.0,
   1.0,
   1.0,
   1.0,
   1.0,
   1.0,
   1.0,
   1.0,
   0.741,
   0.0,
   0.0,
   0.0,
   0.0,
   0.0,
   0.0,
   0.0,
   0.0,
   0.0,
   0.0,
   0.0,
   0.0,
   0.0,
   0.0,
   0.0,
   0.0,
   0.0,
   0.0,
   0.0,
   0.0,
   0.0,
   0.0,
   0.0,
   0.0,
   0.0,
   0.0,
   0.0,
   0.0,
   0.0,
   0.0,
   0.0,
   0.0,
   0.0,
   0.0,
   0.0,
   0.0,
   0.0,
   0.0,
   0.0,
   0.0,
   0.0,
   0.0,
   0.0,
   0.0,
   0.0,
   0.0,
   0.0,
   0.0,
   0.0,
   0.0,
   0.0,
   0.0,
   0.0,
   0.0,
   0.0,
   0.0,
   0.0,
   0.0,
   0.0,
   0.0,
   0.0,
   0.0,
   0.0,
   0.0,
   0.0,
   0.0,
   0.0,
   0.0,
   0.0,
   0.0,
   0.0,
   0.0,
   0.0,
   0.0,
   0.0,
   0.0,
   0.0,
   0.0,
   0.0,
   0.0,
   0.0,
   0.0,
   0.0,
   0.0,
   0.0,
   0.0,
   0.0,
   0.0,
   0.0,
   0.0,
   0.0,
   0.0,
   0.0,
   0.0,
   0.0,
   0.0,
   0.0,
   0.0,
   0.0,
   0.0,
   0.0,
   0.0,
   0.0,
   0.0,
   0.0,
   0.0,
   0.0,
   0.0,
   0.0,
   0.0,
   0.0,
   0.0,
   0.0,
   0.0,
   0.0,
   0.0,
   0.0,
   0.0,
   0.0,
   0.0,
   0.0,
   0.0,
   0.0,
   0.0,
   0.0,
   0.0,
   0.0,
   0.0,
   0.0,
   0.0,
   0.0,
   0.0,
   0.0,
   0.0,
   0.0,
   0.0,
   0.0,
   0.0,
   0.0,
   0.0,
   0.0,
   0.0,
   0.0,
   0.0,
   0.0,
   0.0,
   0.0,
   0.0,
   0.0,
   0.0,
   0.0,
   0.0,
   0.0,
   1.0,
   1.0,
   1.0,
   1.0,
   1.0,
   1.0,
   1.0,
   1.0,
   1.0,
   1.0,
   1.0,
   1.0,
   1.0,
   1.0,
   1.0,
   1.0,
   1.0,
   1.0,
   1.0,
   1.0,
   1.0,
   1.0,
   1.0,
   1.0,
   1.0,
   1.0,
   1.0,
   1.0,
   1.0,
   1.0,
   1.0,
   1.0,
   1.0,
   1.0,
   1.0,
   1.0,
   1.0,
   1.0,
   0.922,
   0.0,
   0.0,
   0.0,
   0.0,
   0.0,
   0.0,
   0.0,
   0.0,
   0.0,
   0.0,
   0.0,
   0.0,
   1.0,
   1.0,
   1.0,
   1.0,
   1.0,
   1.0,
   1.0,
   1.0,
   1.0,
   1.0,
   1.0,
   1.0,
   1.0,
   1.0,
   1.0,
   1.0,
   1.0,
   1.0,
   1.0,
   1.0,
   1.0,
   1.0,
   1.0,
   1.0,
   1.0,
   1.0,
   1.0,
   1.0,
   1.0,
   1.0,
   1.0,
   1.0,
   1.0,
   1.0,
   1.0,
   1.0,
   1.0,
   1.0,
   1.0,
   1.0,
   1.0,
   1.0,
   1.0,
   0.894,
   0.0,
   0.0,
   0.0,
   0.0,
   0.0,
   0.0,
   0.0,
   0.0,
   0.0,
   0.0,
   0.0,
   0.0,
   0.0,
   0.0,
   0.0,
   0.0,
   0.0,
   0.0,
   0.0,
   0.0,
   0.0,
   0.0,
   0.0,
   0.0,
   0.0,
   0.0,
   0.0
  ]
 },
 "avatar": {
  "mode": "none",
  "src": null,
  "position": "bottom_right",
  "height": 620
 },
 "loop_seamless": true,
 "duration_s": 12.46,
 "asset_base": "",
 "seed": 11,
 "show_yt_overlay": false
}