{
 "format": "list_mystery",
 "video_id": null,
 "series_id": null,
 "episode_no": 7,
 "canvas": {
  "w": 1080,
  "h": 1920,
  "fps": 30
 },
 "theme": {
  "palette": {
   "name": "tricolore",
   "bg": "#F4F1EA",
   "bg2": null,
   "title_bg": "#009246",
   "title_text": "#FFFFFF",
   "left_bg": "#CE2B37",
   "left_text": "#FFFFFF",
   "right_bg": "#FFFFFF",
   "right_text": "#141414",
   "highlight_bg": "#009246",
   "highlight_text": "#FFFFFF",
   "highlight_left_text": "#FFE600",
   "accent": "#CE2B37"
  },
  "font": "Montserrat",
  "badge_shape": "square",
  "layout": "center",
  "stickers": [
   {
    "name": "star",
    "x": 860.0,
    "y": 1600.0,
    "size": 124.0,
    "rotate": 12.0
   },
   {
    "name": "italy",
    "x": 950.0,
    "y": 600.0,
    "size": 96.0,
    "rotate": -12.0
   }
  ],
  "bookmark": {
   "enabled": false,
   "position": "top_right"
  },
  "watermark": "@ItalianoPerTe",
  "show_progress_bar": true,
  "second_lang": null
 },
 "hook_text": "Il 90% sbaglia l'ultima",
 "title": "Numeri a una cifra",
 "cta_text": "Scrivi nei commenti 👇",
 "body": {
  "left_style": "badge",
  "speak": "right",
  "hide": "right",
  "reveal": false,
  "items": [
   {
    "left": "0",
    "right": "zero"
   },
   {
    "left": "1",
    "right": "uno"
   },
   {
    "left": "2",
    "right": "due"
   },
   {
    "left": "3",
    "right": "tre"
   },
   {
    "left": "4",
    "right": "quattro"
   },
   {
    "left": "5",
    "right": "cinque"
   },
   {
    "left": "6",
    "right": "sei"
   },
   {
    "left": "7",
    "right": "sette"
   },
   {
    "left": "8",
    "right": "otto"
   },
   {
    "left": "9",
    "right": "nove"
   }
  ]
 },
 "timeline": [
  {
   "t_start": 0.0,
   "t_end": 1.935,
   "action": "hook",
   "target": null
  },
  {
   "t_start": 1.935,
   "t_end": 3.115,
   "action": "highlight",
   "target": 0
  },
  {
   "t_start": 3.115,
   "t_end": 4.295,
   "action": "highlight",
   "target": 1
  },
  {
   "t_start": 4.295,
   "t_end": 5.475,
   "action": "highlight",
   "target": 2
  },
  {
   "t_start": 5.475,
   "t_end": 6.655,
   "action": "highlight",
   "target": 3
  },
  {
   "t_start": 6.655,
   "t_end": 7.835,
   "action": "highlight",
   "target": 4
  },
  {
   "t_start": 7.835,
   "t_end": 9.015,
   "action": "highlight",
   "target": 5
  },
  {
   "t_start": 9.015,
   "t_end": 10.195,
   "action": "highlight",
   "target": 6
  },
  {
   "t_start": 10.195,
   "t_end": 11.375,
   "action": "highlight",
   "target": 7
  },
  {
   "t_start": 11.375,
   "t_end": 12.555,
   "action": "highlight",
   "target": 8
  },
  {
   "t_start": 12.555,
   "t_end": 16.095,
   "action": "highlight",
   "target": 9
  },
  {
   "t_start": 13.735,
   "t_end": 16.095,
   "action": "cta",
   "target": null
  }
 ],
 "audio": {
  "voice_url": null,
  "music_url": null,
  "music_volume": 0.08,
  "sfx": [
   {
    "t": 1.935,
    "name": "pop",
    "volume": 0.35
   },
   {
    "t": 3.115,
    "name": "pop",
    "volume": 0.35
   },
   {
    "t": 4.295,
    "name": "pop",
    "volume": 0.35
   },
   {
    "t": 5.475,
    "name": "pop",
    "volume": 0.35
   },
   {
    "t": 6.655,
    "name": "pop",
    "volume": 0.35
   },
   {
    "t": 7.835,
    "name": "pop",
    "volume": 0.35
   },
   {
    "t": 9.015,
    "name": "pop",
    "volume": 0.35
   },
   {
    "t": 10.195,
    "name": "pop",
    "volume": 0.35
   },
   {
    "t": 11.375,
    "name": "pop",
    "volume": 0.35
   },
   {
    "t": 12.555,
    "name": "pop",
    "volume": 0.35
   },
   {
    "t": 13.735,
    "name": "whoosh",
    "volume": 0.3
   }
  ],
  "envelope": [
   0.0,
   0.0,
   0.0,
   0.632,
   1.0,
   1.0,
   1.0,
   1.0,
   1.0,
   1.0,
   1.0,
   1.0,
   1.0,
   1.0,
   1.0,
   1.0,
   1.0,
   1.0,
   1.0,
   1.0,
   1.0,
   1.0,
   1.0,
   1.0,
   1.0,
   1.0,
   1.0,
   1.0,
   1.0,
   1.0,
   1.0,
   1.0,
   1.0,
   1.0,
   1.0,
   1.0,
   1.0,
   1.0,
   1.0,
   1.0,
   1.0,
   1.0,
   1.0,
   1.0,
   1.0,
   1.0,
   1.0,
   1.0,
   1.0,
   0.223,
   0.0,
   0.0,
   0.0,
   0.0,
   0.0,
   0.0,
   0.0,
   0.0,
   0.975,
   1.0,
   1.0,
   1.0,
   1.0,
   1.0,
   1.0,
   1.0,
   1.0,
   1.0,
   1.0,
   1.0,
   1.0,
   1.0,
   0.388,
   0.0,
   0.0,
   0.0,
   0.0,
   0.0,
   0.0,
   0.0,
   0.0,
   0.0,
   0.0,
   0.0,
   0.0,
   0.0,
   0.0,
   0.0,
   0.0,
   0.0,
   0.0,
   0.0,
   0.0,
   0.741,
   1.0,
   1.0,
   1.0,
   1.0,
   1.0,
   1.0,
   1.0,
   1.0,
   1.0,
   1.0,
   1.0,
   0.949,
   0.0,
   0.0,
   0.0,
   0.0,
   0.0,
   0.0,
   0.0,
   0.0,
   0.0,
   0.0,
   0.0,
   0.0,
   0.0,
   0.0,
   0.0,
   0.0,
   0.0,
   0.0,
   0.0,
   0.0,
   0.0,
   0.0,
   0.387,
   1.0,
   1.0,
   1.0,
   1.0,
   1.0,
   1.0,
   1.0,
   1.0,
   1.0,
   1.0,
   1.0,
   1.0,
   0.548,
   0.0,
   0.0,
   0.0,
   0.0,
   0.0,
   0.0,
   0.0,
   0.0,
   0.0,
   0.0,
   0.0,
   0.0,
   0.0,
   0.0,
   0.0,
   0.0,
   0.0,
   0.0,
   0.0,
   0.0,
   0.0,
   0.0,
   0.866,
   1.0,
   1.0,
   1.0,
   1.0,
   1.0,
   1.0,
   1.0,
   1.0,
   1.0,
   1.0,
   1.0,
   0.836,
   0.0,
   0.0,
   0.0,
   0.0,
   0.0,
   0.0,
   0.0,
   0.0,
   0.0,
   0.0,
   0.0,
   0.0,
   0.0,
   0.0,
   0.0,
   0.0,
   0.0,
   0.0,
   0.0,
   0.0,
   0.0,
   0.0,
   0.591,
   1.0,
   1.0,
   1.0,
   1.0,
   1.0,
   1.0,
   1.0,
   1.0,
   1.0,
   1.0,
   1.0,
   1.0,
   1.0,
   1.0,
   1.0,
   1.0,
   1.0,
   1.0,
   0.837,
   0.0,
   0.0,
   0.0,
   0.0,
   0.0,
   0.0,
   0.0,
   0.0,
   0.0,
   0.0,
   0.0,
   0.0,
   0.0,
   0.0,
   0.0,
   0.0,
   0.975,
   1.0,
   1.0,
   1.0,
   1.0,
   1.0,
   1.0,
   1.0,
   1.0,
   1.0,
   1.0,
   1.0,
   1.0,
   1.0,
   1.0,
   1.0,
   1.0,
   0.671,
   0.0,
   0.0,
   0.0,
   0.0,
   0.0,
   0.0,
   0.0,
   0.0,
   0.0,
   0.0,
   0.0,
   0.0,
   0.0,
   0.0,
   0.0,
   0.0,
   0.0,
   0.741,
   1.0,
   1.0,
   1.0,
   1.0,
   1.0,
   1.0,
   1.0,
   1.0,
   1.0,
   1.0,
   1.0,
   0.949,
   0.0,
   0.0,
   0.0,
   0.0,
   0.0,
   0.0,
   0.0,
   0.0,
   0.0,
   0.0,
   0.0,
   0.0,
   0.0,
   0.0,
   0.0,
   0.0,
   0.0,
   0.0,
   0.0,
   0.0,
   0.0,
   0.0,
   0.387,
   1.0,
   1.0,
   1.0,
   1.0,
   1.0,
   1.0,
   1.0,
   1.0,
   1.0,
   1.0,
   1.0,
   1.0,
   1.0,
   1.0,
   1.0,
   0.775,
   0.0,
   0.0,
   0.0,
   0.0,
   0.0,
   0.0,
   0.0,
   0.0,
   0.0,
   0.0,
   0.0,
   0.0,
   0.0,
   0.0,
   0.0,
   0.0,
   0.0,
   0.0,
   0.0,
   0.866,
   1.0,
   1.0,
   1.0,
   1.0,
   1.0,
   1.0,
   1.0,
   1.0,
   1.0,
   1.0,
   1.0,
   1.0,
   1.0,
   0.592,
   0.0,
   0.0,
   0.0,
   0.0,
   0.0,
   0.0,
   0.0,
   0.0,
   0.0,
   0.0,
   0.0,
   0.0,
   0.0,
   0.0,
   0.0,
   0.0,
   0.0,
   0.0,
   0.0,
   0.0,
   0.0,
   0.0,
   0.0,
   0.0,
   0.0,
   0.0,
   0.0,
   0.0,
   0.0,
   0.0,
   0.0,
   0.0,
   0.0,
   0.0,
   0.0,
   0.0,
   0.0,
   0.0,
   0.0,
   0.0,
   0.0,
   0.0,
   0.0,
   0.0,
   0.0,
   0.0,
   0.0,
   0.0,
   0.0,
   0.0,
   0.0,
   0.0,
   0.0,
   0.0,
   0.0,
   0.0,
   0.975,
   1.0,
   1.0,
   1.0,
   1.0,
   1.0,
   1.0,
   1.0,
   1.0,
   1.0,
   1.0,
   1.0,
   1.0,
   1.0,
   1.0,
   1.0,
   1.0,
   1.0,
   1.0,
   1.0,
   1.0,
   1.0,
   1.0,
   1.0,
   1.0,
   1.0,
   1.0,
   1.0,
   1.0,
   1.0,
   1.0,
   1.0,
   1.0,
   1.0,
   1.0,
   1.0,
   1.0,
   1.0,
   1.0,
   1.0,
   1.0,
   1.0,
   1.0,
   0.922,
   0.0,
   0.0,
   0.0,
   0.0,
   0.0,
   0.0,
   0.0,
   0.0,
   0.0,
   0.0,
   0.0,
   0.0,
   0.0,
   0.0,
   0.0,
   0.0,
   0.0,
   0.0,
   0.0,
   0.0,
   0.0,
   0.0,
   0.0,
   0.0,
   0.0,
   0.0,
   0.0
  ]
 },
 "avatar": {
  "mode": "none",
  "src": null,
  "position": "bottom_right",
  "height": 620
 },
 "loop_seamless": true,
 "duration_s": 16.095,
 "asset_base": "",
 "seed": 11,
 "show_yt_overlay": false
}