{
 "format": "tongue_twister",
 "video_id": null,
 "series_id": null,
 "episode_no": 7,
 "canvas": {
  "w": 1080,
  "h": 1920,
  "fps": 30
 },
 "theme": {
  "palette": {
   "name": "lavanda",
   "bg": "#E9D5FA",
   "bg2": null,
   "title_bg": "#FFE135",
   "title_text": "#1B1B1B",
   "left_bg": "#141414",
   "left_text": "#FFFFFF",
   "right_bg": "#FFFFFF",
   "right_text": "#141414",
   "highlight_bg": "#2DE53A",
   "highlight_text": "#0B2E0F",
   "highlight_left_text": "#FFE600",
   "accent": "#E3262E"
  },
  "font": "Montserrat",
  "badge_shape": "square",
  "layout": "center",
  "stickers": [
   {
    "name": "star",
    "x": 860.0,
    "y": 1600.0,
    "size": 124.0,
    "rotate": 12.0
   },
   {
    "name": "italy",
    "x": 950.0,
    "y": 600.0,
    "size": 96.0,
    "rotate": -12.0
   }
  ],
  "bookmark": {
   "enabled": false,
   "position": "top_right"
  },
  "watermark": "@ItalianoPerTe",
  "show_progress_bar": true,
  "second_lang": null
 },
 "hook_text": "Riesci a dirlo veloce?",
 "title": "Scioglilingua",
 "cta_text": "Scrivi nei commenti 👇",
 "body": {
  "text": "Sopra la panca la capra campa, sotto la panca la capra crepa.",
  "slow_speed": 0.8,
  "fast_speed": 1.25
 },
 "timeline": [
  {
   "t_start": 0.0,
   "t_end": 1.88,
   "action": "hook",
   "target": null
  },
  {
   "t_start": 12.46,
   "t_end": 14.82,
   "action": "cta",
   "target": null
  },
  {
   "t_start": 1.88,
   "t_end": 2.525,
   "action": "word",
   "target": "w:0"
  },
  {
   "t_start": 2.525,
   "t_end": 3.005,
   "action": "word",
   "target": "w:1"
  },
  {
   "t_start": 3.005,
   "t_end": 3.65,
   "action": "word",
   "target": "w:2"
  },
  {
   "t_start": 3.65,
   "t_end": 4.13,
   "action": "word",
   "target": "w:3"
  },
  {
   "t_start": 4.13,
   "t_end": 4.775,
   "action": "word",
   "target": "w:4"
  },
  {
   "t_start": 4.775,
   "t_end": 5.42,
   "action": "word",
   "target": "w:5"
  },
  {
   "t_start": 5.42,
   "t_end": 6.065,
   "action": "word",
   "target": "w:6"
  },
  {
   "t_start": 6.065,
   "t_end": 6.545,
   "action": "word",
   "target": "w:7"
  },
  {
   "t_start": 6.545,
   "t_end": 7.19,
   "action": "word",
   "target": "w:8"
  },
  {
   "t_start": 7.19,
   "t_end": 7.67,
   "action": "word",
   "target": "w:9"
  },
  {
   "t_start": 7.67,
   "t_end": 8.315,
   "action": "word",
   "target": "w:10"
  },
  {
   "t_start": 8.315,
   "t_end": 8.96,
   "action": "word",
   "target": "w:11"
  },
  {
   "t_start": 8.96,
   "t_end": 12.46,
   "action": "speak_fast",
   "target": null
  }
 ],
 "audio": {
  "voice_url": null,
  "music_url": null,
  "music_volume": 0.08,
  "sfx": [
   {
    "t": 12.46,
    "name": "whoosh",
    "volume": 0.3
   },
   {
    "t": 8.96,
    "name": "whoosh",
    "volume": 0.3
   }
  ],
  "envelope": [
   0.0,
   0.0,
   0.0,
   0.632,
   1.0,
   1.0,
   1.0,
   1.0,
   1.0,
   1.0,
   1.0,
   1.0,
   1.0,
   1.0,
   1.0,
   1.0,
   1.0,
   1.0,
   1.0,
   1.0,
   1.0,
   1.0,
   1.0,
   1.0,
   1.0,
   1.0,
   1.0,
   1.0,
   1.0,
   1.0,
   1.0,
   1.0,
   1.0,
   1.0,
   1.0,
   1.0,
   1.0,
   1.0,
   1.0,
   1.0,
   1.0,
   1.0,
   1.0,
   1.0,
   1.0,
   1.0,
   1.0,
   0.632,
   0.0,
   0.0,
   0.0,
   0.0,
   0.0,
   0.0,
   0.0,
   0.0,
   0.775,
   1.0,
   1.0,
   1.0,
   1.0,
   1.0,
   1.0,
   1.0,
   1.0,
   1.0,
   1.0,
   1.0,
   1.0,
   1.0,
   1.0,
   1.0,
   0.387,
   0.0,
   0.0,
   0.5,
   1.0,
   1.0,
   1.0,
   1.0,
   1.0,
   1.0,
   1.0,
   1.0,
   1.0,
   1.0,
   0.741,
   0.0,
   0.0,
   0.0,
   0.922,
   1.0,
   1.0,
   1.0,
   1.0,
   1.0,
   1.0,
   1.0,
   1.0,
   1.0,
   1.0,
   1.0,
   1.0,
   1.0,
   1.0,
   0.948,
   0.0,
   0.0,
   0.0,
   0.707,
   1.0,
   1.0,
   1.0,
   1.0,
   1.0,
   1.0,
   1.0,
   1.0,
   1.0,
   1.0,
   0.548,
   0.0,
   0.0,
   0.316,
   1.0,
   1.0,
   1.0,
   1.0,
   1.0,
   1.0,
   1.0,
   1.0,
   1.0,
   1.0,
   1.0,
   1.0,
   1.0,
   1.0,
   1.0,
   0.806,
   0.0,
   0.0,
   0.0,
   0.866,
   1.0,
   1.0,
   1.0,
   1.0,
   1.0,
   1.0,
   1.0,
   1.0,
   1.0,
   1.0,
   1.0,
   1.0,
   1.0,
   1.0,
   1.0,
   0.0,
   0.0,
   0.0,
   0.632,
   1.0,
   1.0,
   1.0,
   1.0,
   1.0,
   1.0,
   1.0,
   1.0,
   1.0,
   1.0,
   1.0,
   1.0,
   1.0,
   1.0,
   1.0,
   0.591,
   0.0,
   0.0,
   0.23,
   1.0,
   1.0,
   1.0,
   1.0,
   1.0,
   1.0,
   1.0,
   1.0,
   1.0,
   1.0,
   0.864,
   0.0,
   0.0,
   0.0,
   0.808,
   1.0,
   1.0,
   1.0,
   1.0,
   1.0,
   1.0,
   1.0,
   1.0,
   1.0,
   1.0,
   1.0,
   1.0,
   1.0,
   1.0,
   1.0,
   0.311,
   0.0,
   0.0,
   0.55,
   1.0,
   1.0,
   1.0,
   1.0,
   1.0,
   1.0,
   1.0,
   1.0,
   1.0,
   1.0,
   0.705,
   0.0,
   0.0,
   0.0,
   0.95,
   1.0,
   1.0,
   1.0,
   1.0,
   1.0,
   1.0,
   1.0,
   1.0,
   1.0,
   1.0,
   1.0,
   1.0,
   1.0,
   1.0,
   0.92,
   0.0,
   0.0,
   0.0,
   0.744,
   1.0,
   1.0,
   1.0,
   1.0,
   1.0,
   1.0,
   1.0,
   1.0,
   1.0,
   1.0,
   1.0,
   1.0,
   1.0,
   1.0,
   1.0,
   0.443,
   0.0,
   0.0,
   0.45,
   1.0,
   1.0,
   1.0,
   1.0,
   1.0,
   1.0,
   1.0,
   1.0,
   1.0,
   1.0,
   1.0,
   1.0,
   1.0,
   1.0,
   1.0,
   1.0,
   1.0,
   1.0,
   1.0,
   1.0,
   1.0,
   1.0,
   1.0,
   1.0,
   1.0,
   1.0,
   1.0,
   1.0,
   1.0,
   1.0,
   1.0,
   1.0,
   1.0,
   1.0,
   1.0,
   1.0,
   1.0,
   1.0,
   1.0,
   1.0,
   1.0,
   1.0,
   1.0,
   1.0,
   1.0,
   1.0,
   1.0,
   1.0,
   1.0,
   1.0,
   1.0,
   1.0,
   1.0,
   1.0,
   1.0,
   1.0,
   1.0,
   1.0,
   1.0,
   1.0,
   1.0,
   1.0,
   1.0,
   1.0,
   1.0,
   1.0,
   1.0,
   1.0,
   1.0,
   1.0,
   1.0,
   1.0,
   1.0,
   1.0,
   1.0,
   1.0,
   1.0,
   1.0,
   1.0,
   1.0,
   1.0,
   1.0,
   1.0,
   1.0,
   1.0,
   1.0,
   1.0,
   1.0,
   1.0,
   0.893,
   0.0,
   0.0,
   0.0,
   0.0,
   0.0,
   0.0,
   0.0,
   0.0,
   0.0,
   0.0,
   0.0,
   0.0,
   0.0,
   0.0,
   0.45,
   1.0,
   1.0,
   1.0,
   1.0,
   1.0,
   1.0,
   1.0,
   1.0,
   1.0,
   1.0,
   1.0,
   1.0,
   1.0,
   1.0,
   1.0,
   1.0,
   1.0,
   1.0,
   1.0,
   1.0,
   1.0,
   1.0,
   1.0,
   1.0,
   1.0,
   1.0,
   1.0,
   1.0,
   1.0,
   1.0,
   1.0,
   1.0,
   1.0,
   1.0,
   1.0,
   1.0,
   1.0,
   1.0,
   1.0,
   1.0,
   1.0,
   1.0,
   1.0,
   0.773,
   0.0,
   0.0,
   0.0,
   0.0,
   0.0,
   0.0,
   0.0,
   0.0,
   0.0,
   0.0,
   0.0,
   0.0,
   0.0,
   0.0,
   0.0,
   0.0,
   0.0,
   0.0,
   0.0,
   0.0,
   0.0,
   0.0,
   0.0,
   0.0,
   0.0,
   0.0,
   0.0
  ]
 },
 "avatar": {
  "mode": "none",
  "src": null,
  "position": "bottom_right",
  "height": 620
 },
 "loop_seamless": true,
 "duration_s": 14.82,
 "asset_base": "",
 "seed": 11,
 "show_yt_overlay": false
}