{
 "format": "emoji_vocab",
 "video_id": null,
 "series_id": null,
 "episode_no": 7,
 "canvas": {
  "w": 1080,
  "h": 1920,
  "fps": 30
 },
 "theme": {
  "palette": {
   "name": "cielo",
   "bg": "#D9DCFF",
   "bg2": null,
   "title_bg": "#FFE135",
   "title_text": "#1B1B1B",
   "left_bg": "#232A6B",
   "left_text": "#FFFFFF",
   "right_bg": "#FFFFFF",
   "right_text": "#141414",
   "highlight_bg": "#2DE53A",
   "highlight_text": "#0B2E0F",
   "highlight_left_text": "#FFE600",
   "accent": "#E3262E"
  },
  "font": "Montserrat",
  "badge_shape": "square",
  "layout": "center",
  "stickers": [
   {
    "name": "star",
    "x": 860.0,
    "y": 1600.0,
    "size": 124.0,
    "rotate": 12.0
   },
   {
    "name": "italy",
    "x": 950.0,
    "y": 600.0,
    "size": 96.0,
    "rotate": -12.0
   }
  ],
  "bookmark": {
   "enabled": false,
   "position": "top_right"
  },
  "watermark": "@ItalianoPerTe",
  "show_progress_bar": true,
  "second_lang": null
 },
 "hook_text": "Come si dice?",
 "title": "Gli animali",
 "cta_text": "Scrivi nei commenti 👇",
 "body": {
  "items": [
   {
    "emoji": "🐶",
    "word": "cane",
    "article": "il"
   },
   {
    "emoji": "🐱",
    "word": "gatto",
    "article": "il"
   },
   {
    "emoji": "🐭",
    "word": "topo",
    "article": "il"
   },
   {
    "emoji": "🐰",
    "word": "coniglio",
    "article": "il"
   },
   {
    "emoji": "🐷",
    "word": "maiale",
    "article": "il"
   },
   {
    "emoji": "🐮",
    "word": "mucca",
    "article": "la"
   },
   {
    "emoji": "🐴",
    "word": "cavallo",
    "article": "il"
   },
   {
    "emoji": "🐸",
    "word": "rana",
    "article": "la"
   }
  ]
 },
 "timeline": [
  {
   "t_start": 0.0,
   "t_end": 1.385,
   "action": "hook",
   "target": null
  },
  {
   "t_start": 12.025,
   "t_end": 14.385,
   "action": "cta",
   "target": null
  },
  {
   "t_start": 1.385,
   "t_end": 2.715,
   "action": "highlight",
   "target": "row:0"
  },
  {
   "t_start": 2.715,
   "t_end": 4.045,
   "action": "highlight",
   "target": "row:1"
  },
  {
   "t_start": 4.045,
   "t_end": 5.375,
   "action": "highlight",
   "target": "row:2"
  },
  {
   "t_start": 5.375,
   "t_end": 6.705,
   "action": "highlight",
   "target": "row:3"
  },
  {
   "t_start": 6.705,
   "t_end": 8.035,
   "action": "highlight",
   "target": "row:4"
  },
  {
   "t_start": 8.035,
   "t_end": 9.365,
   "action": "highlight",
   "target": "row:5"
  },
  {
   "t_start": 9.365,
   "t_end": 10.695,
   "action": "highlight",
   "target": "row:6"
  },
  {
   "t_start": 10.695,
   "t_end": 14.385,
   "action": "highlight",
   "target": "row:7"
  }
 ],
 "audio": {
  "voice_url": null,
  "music_url": null,
  "music_volume": 0.08,
  "sfx": [
   {
    "t": 12.025,
    "name": "whoosh",
    "volume": 0.25
   },
   {
    "t": 1.385,
    "name": "pop",
    "volume": 0.3
   },
   {
    "t": 2.715,
    "name": "pop",
    "volume": 0.3
   },
   {
    "t": 4.045,
    "name": "pop",
    "volume": 0.3
   },
   {
    "t": 5.375,
    "name": "pop",
    "volume": 0.3
   },
   {
    "t": 6.705,
    "name": "pop",
    "volume": 0.3
   },
   {
    "t": 8.035,
    "name": "pop",
    "volume": 0.3
   },
   {
    "t": 9.365,
    "name": "pop",
    "volume": 0.3
   },
   {
    "t": 10.695,
    "name": "pop",
    "volume": 0.3
   }
  ],
  "envelope": [
   0.0,
   0.0,
   0.0,
   0.632,
   1.0,
   1.0,
   1.0,
   1.0,
   1.0,
   1.0,
   1.0,
   1.0,
   1.0,
   1.0,
   1.0,
   1.0,
   1.0,
   1.0,
   1.0,
   1.0,
   1.0,
   1.0,
   1.0,
   1.0,
   1.0,
   1.0,
   1.0,
   1.0,
   1.0,
   1.0,
   1.0,
   1.0,
   0.741,
   0.0,
   0.0,
   0.0,
   0.0,
   0.0,
   0.0,
   0.0,
   0.0,
   0.671,
   1.0,
   1.0,
   1.0,
   1.0,
   1.0,
   1.0,
   1.0,
   1.0,
   1.0,
   1.0,
   1.0,
   1.0,
   1.0,
   1.0,
   1.0,
   1.0,
   1.0,
   1.0,
   0.774,
   0.0,
   0.0,
   0.0,
   0.0,
   0.0,
   0.0,
   0.0,
   0.0,
   0.0,
   0.0,
   0.0,
   0.0,
   0.0,
   0.0,
   0.0,
   0.0,
   0.0,
   0.0,
   0.0,
   0.0,
   0.741,
   1.0,
   1.0,
   1.0,
   1.0,
   1.0,
   1.0,
   1.0,
   1.0,
   1.0,
   1.0,
   1.0,
   1.0,
   1.0,
   1.0,
   1.0,
   1.0,
   1.0,
   1.0,
   1.0,
   1.0,
   0.387,
   0.0,
   0.0,
   0.0,
   0.0,
   0.0,
   0.0,
   0.0,
   0.0,
   0.0,
   0.0,
   0.0,
   0.0,
   0.0,
   0.0,
   0.0,
   0.0,
   0.0,
   0.0,
   0.806,
   1.0,
   1.0,
   1.0,
   1.0,
   1.0,
   1.0,
   1.0,
   1.0,
   1.0,
   1.0,
   1.0,
   1.0,
   1.0,
   1.0,
   1.0,
   1.0,
   1.0,
   1.0,
   0.632,
   0.0,
   0.0,
   0.0,
   0.0,
   0.0,
   0.0,
   0.0,
   0.0,
   0.0,
   0.0,
   0.0,
   0.0,
   0.0,
   0.0,
   0.0,
   0.0,
   0.0,
   0.0,
   0.0,
   0.0,
   0.866,
   1.0,
   1.0,
   1.0,
   1.0,
   1.0,
   1.0,
   1.0,
   1.0,
   1.0,
   1.0,
   1.0,
   1.0,
   1.0,
   1.0,
   1.0,
   1.0,
   1.0,
   1.0,
   1.0,
   1.0,
   1.0,
   1.0,
   1.0,
   1.0,
   0.949,
   0.0,
   0.0,
   0.0,
   0.0,
   0.0,
   0.0,
   0.0,
   0.0,
   0.0,
   0.0,
   0.0,
   0.0,
   0.0,
   0.0,
   0.922,
   1.0,
   1.0,
   1.0,
   1.0,
   1.0,
   1.0,
   1.0,
   1.0,
   1.0,
   1.0,
   1.0,
   1.0,
   1.0,
   1.0,
   1.0,
   1.0,
   1.0,
   1.0,
   1.0,
   1.0,
   1.0,
   0.707,
   0.0,
   0.0,
   0.0,
   0.0,
   0.0,
   0.0,
   0.0,
   0.0,
   0.0,
   0.0,
   0.0,
   0.0,
   0.0,
   0.0,
   0.0,
   0.0,
   0.0,
   0.975,
   1.0,
   1.0,
   1.0,
   1.0,
   1.0,
   1.0,
   1.0,
   1.0,
   1.0,
   1.0,
   1.0,
   1.0,
   1.0,
   1.0,
   1.0,
   1.0,
   1.0,
   1.0,
   1.0,
   0.866,
   0.0,
   0.0,
   0.0,
   0.0,
   0.0,
   0.0,
   0.0,
   0.0,
   0.0,
   0.0,
   0.0,
   0.0,
   0.0,
   0.0,
   0.0,
   0.0,
   0.0,
   0.0,
   0.224,
   1.0,
   1.0,
   1.0,
   1.0,
   1.0,
   1.0,
   1.0,
   1.0,
   1.0,
   1.0,
   1.0,
   1.0,
   1.0,
   1.0,
   1.0,
   1.0,
   1.0,
   1.0,
   1.0,
   1.0,
   1.0,
   1.0,
   1.0,
   0.975,
   0.0,
   0.0,
   0.0,
   0.0,
   0.0,
   0.0,
   0.0,
   0.0,
   0.0,
   0.0,
   0.0,
   0.0,
   0.0,
   0.0,
   0.0,
   0.0,
   0.0,
   0.0,
   0.0,
   0.0,
   0.0,
   0.0,
   0.0,
   0.0,
   0.0,
   0.0,
   0.0,
   0.0,
   0.0,
   0.0,
   0.0,
   0.0,
   0.0,
   0.0,
   0.0,
   0.0,
   0.0,
   0.0,
   0.0,
   0.0,
   0.0,
   0.0,
   0.0,
   0.0,
   0.0,
   0.0,
   0.0,
   0.0,
   0.0,
   0.0,
   0.0,
   0.0,
   0.0,
   0.0,
   0.0,
   0.5,
   1.0,
   1.0,
   1.0,
   1.0,
   1.0,
   1.0,
   1.0,
   1.0,
   1.0,
   1.0,
   1.0,
   1.0,
   1.0,
   1.0,
   1.0,
   1.0,
   1.0,
   1.0,
   1.0,
   1.0,
   1.0,
   1.0,
   1.0,
   1.0,
   1.0,
   1.0,
   1.0,
   1.0,
   1.0,
   1.0,
   1.0,
   1.0,
   1.0,
   1.0,
   1.0,
   1.0,
   1.0,
   1.0,
   1.0,
   1.0,
   1.0,
   1.0,
   1.0,
   0.741,
   0.0,
   0.0,
   0.0,
   0.0,
   0.0,
   0.0,
   0.0,
   0.0,
   0.0,
   0.0,
   0.0,
   0.0,
   0.0,
   0.0,
   0.0,
   0.0,
   0.0,
   0.0,
   0.0,
   0.0,
   0.0,
   0.0,
   0.0,
   0.0,
   0.0,
   0.0,
   0.0
  ]
 },
 "avatar": {
  "mode": "none",
  "src": null,
  "position": "bottom_right",
  "height": 620
 },
 "loop_seamless": true,
 "duration_s": 14.385,
 "asset_base": "",
 "seed": 11,
 "show_yt_overlay": false
}